<?xml version="1.0" encoding="UTF-8"?>
<xs:schema xmlns:xs="http://www.w3.org/2001/XMLSchema" 
            elementFormDefault="qualified" >

  <xs:annotation>
    <xs:documentation xml:lang="en">
      Part of extensions for Romeo.jl
    </xs:documentation>
  </xs:annotation>


  <!-- Comma separated lists of numbers -->
  <xs:simpleType name="listofIntsType">
     <xs:restriction base="xs:string">
        <xs:pattern value="(\d,)*\d"/>
     </xs:restriction>
  </xs:simpleType>


  <xs:simpleType name="listofFLoatsType">
     <xs:restriction base="xs:string">
        <xs:pattern value="(\d(.\d,)?)*\d(.\d)?"/>
     </xs:restriction>
  </xs:simpleType>

  <xs:simpleType name="listofFLoatExprType">
      <!--here we admit a list of Julia expressions , may be the pattern is
          too permissive ?? -->
     <xs:restriction base="xs:string">
        <xs:pattern value=".*"/>
     </xs:restriction>
  </xs:simpleType>


  <xs:element name="scene" type="sceneType"/>
  <xs:complexType name="sceneType">
   <xs:sequence>
    <!-- is this optional ???? -->
    <xs:element name="rootScreen" type="subscreenType" 
		maxOccurs="1"    minOccurs="0" />
    <xs:sequence>
       <xs:element name="subscreen"  type="subscreenType"
                   maxOccurs="unbounded" />
    </xs:sequence>
    <xs:sequence>
       <xs:element name="setplot" type="setplotType"
                   maxOccurs="unbounded" />
    </xs:sequence>
    <xs:sequence>
      <xs:element name="connection" type="connectionType"
                  maxOccurs="unbounded"  minOccurs="0"/>
    </xs:sequence>
    <xs:sequence>
     <xs:element name="debug" type="debugType"/>
    </xs:sequence>
   </xs:sequence>
  </xs:complexType>

  <xs:complexType name="subscreenType">
    <xs:sequence >
      <xs:element name="rowsizes" type="listofFLoatsType" 
                  maxOccurs="1"    minOccurs="0" />
      <xs:element name="colsizes" type="listofFLoatsType"
                  maxOccurs="1"    minOccurs="0" />
      <xs:element name="table" type="TableType"
                  maxOccurs="1"    minOccurs="0"/>
    </xs:sequence>
    <xs:attribute name="rows" type="xs:integer"/>
    <xs:attribute name="cols" type="xs:integer"/>
    <xs:attribute name="name" type="xs:string"/>
  </xs:complexType>

  <xs:element name="table" type="TableType"/>
  <xs:complexType name="TableType">  
    <xs:sequence>
          <xs:element name="tr"  type="TableRowType"
                      maxOccurs="unbounded"  />
    </xs:sequence>
  </xs:complexType>

  <xs:complexType name="TableRowType">  
    <xs:sequence>
           <xs:element name="subscreen" type="subscreenType"
                       maxOccurs="unbounded" />
    </xs:sequence>
  </xs:complexType>


  <xs:complexType name="setplotType">
    <xs:sequence>
      <xs:element name="rotateModel" type="listofFLoatExprType"
                  minOccurs="0" />
    </xs:sequence>
    <xs:attribute name="ref" type="xs:string"/>
    <xs:attribute name="fn" type="xs:string"/>
  </xs:complexType>


  <xs:simpleType name="listofSignals">
      <!--here we admit a list of Symbols (in Julia syntax ":xxxxx"
          this pattern is too permissive ?? -->
     <xs:restriction base="xs:string">
        <xs:pattern value=".*"/>
     </xs:restriction>
  </xs:simpleType>

  <xs:complexType name="connectionType">
    <xs:sequence>
      <xs:element name="inSig" type="listofSignals"/>
      <xs:element name="outSig" type="listofSignals"/>
    </xs:sequence>
    <xs:attribute name="from" type="xs:string"/>
    <xs:attribute name="to"   type="xs:string"/>
  </xs:complexType>



  <!-- instruct to print a dump of a subscreen at the end of XML 
       semantics processing 
   -->
  <xs:element name="dump" type="dumpType"/>
  <xs:complexType name="dumpType">
    <xs:attribute name="ref" type="xs:string"/>
  </xs:complexType>

  <!--Perform a set of debug actions -->
  <xs:complexType name="debugType">
    <xs:sequence>
      <xs:element name="dump" type="dumpType" 
                  maxOccurs="unbounded" />
    </xs:sequence>
  </xs:complexType>

</xs:schema>


