<?xml version="1.0" encoding="UTF-8"?>
<scene xmlns:xsi="http://www.w3.org/2001/XMLSchema-instance" 
             xsi:noNamespaceSchemaLocation="subscreenSchema.xsd">

<!-- Subscreen description -->

 <subscreen rows="2" cols="2" name="MAIN">
  <rowsizes>1,3</rowsizes>
  <colsizes>4,3</colsizes>
  <table>
    <tr>
     <subscreen name="A1"/>
     <subscreen name="A2"/>
     </tr>
    <tr>
     <subscreen name="B1"/>
     <subscreen name="INNER"/>
     </tr>
   </table>
 </subscreen>

 <subscreen rows="4" cols="1" name="INNER">
  <rowsizes>1,1,1,1</rowsizes>
  <colsizes>1</colsizes>
  <table>
    <tr>
     <subscreen name="IA1"/>
    </tr>
    <tr>
     <subscreen name="IB1"/>
    </tr>
    <tr>
     <subscreen name="IC1"/>
    </tr>
    <tr>
     <subscreen name="ID1"/>
    </tr>
   </table>
 </subscreen>

<!-- Subscreen contents -->

 <setplot  ref="A1"  fn="doEdit"/>
 <setplot  ref="A2"  fn="doPlot2D"/>
 <setplot  ref="B1"  fn="doPlot3D"/>

 <setplot  ref="IA1"  fn="doColorBtn"/>
 <setplot  ref="IB1"  fn="doPlot2D"> 
      <rotateModel>Pi/2, 0.0, 0.0</rotateModel>
 </setplot>
 <setplot  ref="IC1"  fn="doPlot2D">
      <rotateModel>0.0, Pi/2, 0.0</rotateModel>
 </setplot>
 <setplot  ref="ID1"  fn="doPlot2D">
      <rotateModel>0.0, 0.0, Pi/2</rotateModel>
 </setplot>

 <!-- Connectors -->
 <connection from="B1" to="A2"> 
            <inSig>:view   , :projection,    :projectionview, :projection</inSig>
            <outSig>:view , :projectionview,:projection,    :projection </outSig>
 </connection>
 <connection from="IA1" to="A2"> 
            <inSig>:color</inSig>
            <outSig>:color</outSig>
 </connection>
 <connection from="IA1" to="B1"> 
            <inSig>:color</inSig>
            <outSig>:color</outSig>
 </connection>
 <connection from="IA1" to="IC1"> 
            <inSig>:color</inSig>
            <outSig>:color</outSig>
 </connection>
 <connection from="IA1" to="ID1"> 
            <inSig>:color</inSig>
            <outSig>:color</outSig>
 </connection>


 <!-- Debug options -->

<debug>
    <dump ref="A2"/>
    <dump ref="B1"/>
    <dump ref="IA1"/>
</debug>

</scene>
<!-- This ends the scene-->
